{
  "api": 1,
  "name": "the cmdy marketplace",
  "featured": [
    "cmdy/breath",
    "cmdy/waterline",
    "cmdy/cmdy",
    "dev.termite.demo-inbox",
    "dev.termite.chromium",
    "dev.termite.detox"
  ],
  "entries": [
    {
      "kind": "shader",
      "id": "cmdy/drift",
      "name": "Drift",
      "description": "a dual-tone color field slowly folding over itself",
      "author": "cmdy",
      "license": "MIT",
      "version": "1.0.0",
      "file": "shaders/cmdy/drift.metal"
    },
    {
      "kind": "shader",
      "id": "cmdy/breath",
      "name": "Breath",
      "description": "the background inhales on an 8s cycle; idling deepens it",
      "author": "cmdy",
      "license": "MIT",
      "version": "1.0.0",
      "file": "shaders/cmdy/breath.metal"
    },
    {
      "kind": "shader",
      "id": "cmdy/lagoon",
      "name": "Lagoon",
      "description": "teal caustic light webs, pool-floor slow",
      "author": "cmdy",
      "license": "MIT",
      "version": "1.0.0",
      "file": "shaders/cmdy/lagoon.metal"
    },
    {
      "kind": "shader",
      "id": "cmdy/silk",
      "name": "Silk",
      "description": "translucent ribbons swaying, dusty violet",
      "author": "cmdy",
      "license": "MIT",
      "version": "1.0.0",
      "file": "shaders/cmdy/silk.metal"
    },
    {
      "kind": "shader",
      "id": "cmdy/ember",
      "name": "Ember",
      "description": "sparse warm motes rising and winking out",
      "author": "cmdy",
      "license": "MIT",
      "version": "1.0.0",
      "file": "shaders/cmdy/ember.metal"
    },
    {
      "kind": "shader",
      "id": "cmdy/fireflies",
      "name": "Fireflies",
      "description": "wandering green-gold points, soft blinking",
      "author": "cmdy",
      "license": "MIT",
      "version": "1.0.0",
      "file": "shaders/cmdy/fireflies.metal"
    },
    {
      "kind": "shader",
      "id": "cmdy/clouds",
      "name": "Clouds",
      "description": "a pale cloud bank crossing at stratus pace",
      "author": "cmdy",
      "license": "MIT",
      "version": "1.0.0",
      "file": "shaders/cmdy/clouds.metal"
    },
    {
      "kind": "shader",
      "id": "cmdy/mist",
      "name": "Mist",
      "description": "ground fog breathing along the bottom",
      "author": "cmdy",
      "license": "MIT",
      "version": "1.0.0",
      "file": "shaders/cmdy/mist.metal"
    },
    {
      "kind": "shader",
      "id": "cmdy/deep",
      "name": "Deep",
      "description": "abyssal gradient; a faint sonar ring every nine seconds",
      "author": "cmdy",
      "license": "MIT",
      "version": "1.0.0",
      "file": "shaders/cmdy/deep.metal"
    },
    {
      "kind": "shader",
      "id": "cmdy/tide",
      "name": "Tide",
      "description": "a waterline breathing at two-thirds height, foam whisper",
      "author": "cmdy",
      "license": "MIT",
      "version": "1.0.0",
      "file": "shaders/cmdy/tide.metal"
    },
    {
      "kind": "shader",
      "id": "cmdy/zen",
      "name": "Zen",
      "description": "raked sand rings around two slowly orbiting stones",
      "author": "cmdy",
      "license": "MIT",
      "version": "1.0.0",
      "file": "shaders/cmdy/zen.metal"
    },
    {
      "kind": "shader",
      "id": "cmdy/lanterns",
      "name": "Lanterns",
      "description": "five paper lanterns climbing on staggered loops",
      "author": "cmdy",
      "license": "MIT",
      "version": "1.0.0",
      "file": "shaders/cmdy/lanterns.metal"
    },
    {
      "kind": "shader",
      "id": "cmdy/snowfall",
      "name": "Snowfall",
      "description": "three parallax layers of unhurried flakes",
      "author": "cmdy",
      "license": "MIT",
      "version": "1.0.0",
      "file": "shaders/cmdy/snowfall.metal"
    },
    {
      "kind": "shader",
      "id": "cmdy/petals",
      "name": "Petals",
      "description": "pink petals drifting down-wind with a sway",
      "author": "cmdy",
      "license": "MIT",
      "version": "1.0.0",
      "file": "shaders/cmdy/petals.metal"
    },
    {
      "kind": "shader",
      "id": "cmdy/koi",
      "name": "Koi",
      "description": "three blurred koi gliding under frosted ice",
      "author": "cmdy",
      "license": "MIT",
      "version": "1.0.0",
      "file": "shaders/cmdy/koi.metal"
    },
    {
      "kind": "shader",
      "id": "cmdy/moss",
      "name": "Moss",
      "description": "green mottle creeping at lichen speed",
      "author": "cmdy",
      "license": "MIT",
      "version": "1.0.0",
      "file": "shaders/cmdy/moss.metal"
    },
    {
      "kind": "shader",
      "id": "cmdy/dunes",
      "name": "Dunes",
      "description": "layered dune silhouettes, crest light, sand haze",
      "author": "cmdy",
      "license": "MIT",
      "version": "1.0.0",
      "file": "shaders/cmdy/dunes.metal"
    },
    {
      "kind": "shader",
      "id": "cmdy/horizon",
      "name": "Horizon",
      "description": "a dawn gradient whose mood shifts over three minutes",
      "author": "cmdy",
      "license": "MIT",
      "version": "1.0.0",
      "file": "shaders/cmdy/horizon.metal"
    },
    {
      "kind": "shader",
      "id": "cmdy/rainfall",
      "name": "Rainfall",
      "description": "rain trails sliding down window glass",
      "author": "cmdy",
      "license": "MIT",
      "version": "1.0.0",
      "file": "shaders/cmdy/rainfall.metal"
    },
    {
      "kind": "shader",
      "id": "cmdy/nebula",
      "name": "Nebula",
      "description": "slow-turning gas in magenta and indigo, dim stars",
      "author": "cmdy",
      "license": "MIT",
      "version": "1.0.0",
      "file": "shaders/cmdy/nebula.metal"
    },
    {
      "kind": "shader",
      "id": "cmdy/comet",
      "name": "Comet",
      "description": "every ~17s one soft comet crosses the upper sky",
      "author": "cmdy",
      "license": "MIT",
      "version": "1.0.0",
      "file": "shaders/cmdy/comet.metal"
    },
    {
      "kind": "shader",
      "id": "cmdy/meadow",
      "name": "Meadow",
      "description": "green ground glow + pollen adrift",
      "author": "cmdy",
      "license": "MIT",
      "version": "1.0.0",
      "file": "shaders/cmdy/meadow.metal"
    },
    {
      "kind": "shader",
      "id": "cmdy/ink",
      "name": "Ink",
      "description": "ink blots blooming and dissolving in water",
      "author": "cmdy",
      "license": "MIT",
      "version": "1.0.0",
      "file": "shaders/cmdy/ink.metal"
    },
    {
      "kind": "shader",
      "id": "cmdy/marble",
      "name": "Marble",
      "description": "fine veins wandering through warped stone",
      "author": "cmdy",
      "license": "MIT",
      "version": "1.0.0",
      "file": "shaders/cmdy/marble.metal"
    },
    {
      "kind": "shader",
      "id": "cmdy/prism",
      "name": "Prism",
      "description": "one faint light shaft, spectrum-fringed, slowly swinging",
      "author": "cmdy",
      "license": "MIT",
      "version": "1.0.0",
      "file": "shaders/cmdy/prism.metal"
    },
    {
      "kind": "shader",
      "id": "cmdy/halo",
      "name": "Halo",
      "description": "a breathing glow that follows the cursor",
      "author": "cmdy",
      "license": "MIT",
      "version": "1.0.0",
      "file": "shaders/cmdy/halo.metal"
    },
    {
      "kind": "shader",
      "id": "cmdy/waterline",
      "name": "Waterline",
      "description": "the scene reflects in water along the bottom edge",
      "author": "cmdy",
      "license": "MIT",
      "version": "1.0.0",
      "file": "shaders/cmdy/waterline.metal"
    },
    {
      "kind": "shader",
      "id": "cmdy/slowscan",
      "name": "Slowscan",
      "description": "a luminous band sweeps down every twelve seconds",
      "author": "cmdy",
      "license": "MIT",
      "version": "1.0.0",
      "file": "shaders/cmdy/slowscan.metal"
    },
    {
      "kind": "shader",
      "id": "cmdy/voronoi",
      "name": "Voronoi",
      "description": "drifting cells, edges barely glowing",
      "author": "cmdy",
      "license": "MIT",
      "version": "1.0.0",
      "file": "shaders/cmdy/voronoi.metal"
    },
    {
      "kind": "shader",
      "id": "cmdy/eclipse",
      "name": "Eclipse",
      "description": "a dark disc with a breathing corona, upper right",
      "author": "cmdy",
      "license": "MIT",
      "version": "1.0.0",
      "file": "shaders/cmdy/eclipse.metal"
    },
    {
      "kind": "theme",
      "id": "cmdy/cmdy",
      "name": "cmdy",
      "description": "the mark's palette: near-black, off-white, quiet accents",
      "author": "cmdy",
      "license": "MIT",
      "version": "1.0.0",
      "file": "themes/cmdy/cmdy.json"
    },
    {
      "kind": "theme",
      "id": "cmdy/c64",
      "name": "C64",
      "description": "Pepto palette — blue on blue, the original",
      "author": "cmdy",
      "license": "MIT",
      "version": "1.0.0",
      "file": "themes/cmdy/c64.json"
    },
    {
      "kind": "theme",
      "id": "cmdy/amber",
      "name": "Amber",
      "description": "one amber ink, phosphor warm",
      "author": "cmdy",
      "license": "MIT",
      "version": "1.0.0",
      "file": "themes/cmdy/amber.json"
    },
    {
      "kind": "theme",
      "id": "cmdy/green",
      "name": "Green",
      "description": "one green ink, straight from the bunker",
      "author": "cmdy",
      "license": "MIT",
      "version": "1.0.0",
      "file": "themes/cmdy/green.json"
    },
    {
      "kind": "rig",
      "id": "cmdy/midnight-drift",
      "name": "Midnight Drift",
      "description": "dark room, slow color field, bar cursor",
      "author": "cmdy",
      "license": "MIT",
      "version": "1.0.0",
      "file": "rigs/cmdy/midnight-drift.conf"
    },
    {
      "kind": "rig",
      "id": "cmdy/c64-forever",
      "name": "C64 Forever",
      "description": "the machine this terminal remembers",
      "author": "cmdy",
      "license": "MIT",
      "version": "1.0.0",